Difference|date|nextClose|nextDay|prevClose|prevDay|text
16.850000000000023|2014-03-18|903.0|2014-03-19|886.15|2014-03-14|Reliance Jio to ride on 42000 Viom Networks' towers
16.850000000000023|2014-03-18|903.0|2014-03-19|886.15|2014-03-14|Reliance Jio signs tower leasing pact with Viom
16.850000000000023|2014-03-18|903.0|2014-03-19|886.15|2014-03-14|Viom tenancy ratio to jump post Rel Jio deal: SREI  Infra
-17.200000000000045|2014-03-20|885.8|2014-03-21|903.0|2014-03-19|Buy OMCs on correction, says Sudarshan Sukhani
-17.200000000000045|2014-03-20|885.8|2014-03-21|903.0|2014-03-19|Buy Axis Bank, Reliance Industries: Sudarshan Sukhani
-17.850000000000023|2014-03-21|888.15|2014-03-22|906.0|2014-03-20|Top 10 stocks: Keep a eye on Infosys, Axis Bank,RIL
-17.850000000000023|2014-03-21|888.15|2014-03-22|906.0|2014-03-20|Buy Reliance Industries: Sudarshan Sukhani
19.600000000000023|2014-03-22|905.4|2014-03-24|885.8|2014-03-21|Buy Reliance Industries at around Rs 880-890: Sukhani
-8.850000000000023|2014-03-24|879.3|2014-03-25|888.15|2014-03-22|Check out: Top 10 stocks for the day
-8.850000000000023|2014-03-24|879.3|2014-03-25|888.15|2014-03-22|Uncertainty reigns as gas price hike date nears
-14.199999999999932|2014-03-25|891.2|2014-03-26|905.4|2014-03-24|ONGC, Russia's Rosneft may join forces to send oil to India
-14.199999999999932|2014-03-25|891.2|2014-03-26|905.4|2014-03-24|Kunal Saraogi bullish on ONGC
-14.199999999999932|2014-03-25|891.2|2014-03-26|905.4|2014-03-24|Go long in BPCL; RIL may test Rs 845: Ashish Chaturmohta
-14.199999999999932|2014-03-25|891.2|2014-03-26|905.4|2014-03-24|Buy Reliance Industries on correction: Ajay Bodke
-14.199999999999932|2014-03-25|891.2|2014-03-26|905.4|2014-03-24|Gas price hike put off: How to play ONGC, RIL now
-14.199999999999932|2014-03-25|891.2|2014-03-26|905.4|2014-03-24|Top 10 stocks to be watched out for today
-14.199999999999932|2014-03-25|891.2|2014-03-26|905.4|2014-03-24|Expect new govt to see merit of gas price hike: ONGC
-14.199999999999932|2014-03-25|891.2|2014-03-26|905.4|2014-03-24|Buy Reliance Industries, ONGC: Gautam Chhaochharia
24.949999999999932|2014-03-27|916.15|2014-03-28|891.2|2014-03-26|Reliance Industries: Updates on maintenance shutdown of Xylene unit, Jamnagar
24.949999999999932|2014-03-27|916.15|2014-03-28|891.2|2014-03-26|RIL's gas pricing case adjourned till April 1
30.0|2014-03-28|930.75|2014-03-31|900.75|2014-03-27|Top 10 stocks to give your portfolio a good weekend
14.600000000000023|2014-03-30|930.75|2014-03-31|916.15|2014-03-28|Gas price: New govt may relook Rangarajan formula
26.450000000000045|2014-03-31|942.6|2014-04-01|916.15|2014-03-28|Super Six: Top chart picks for today
26.450000000000045|2014-03-31|942.6|2014-04-01|916.15|2014-03-28|Buy Reliance Industries: Sudarshan Sukhani
26.450000000000045|2014-03-31|942.6|2014-04-01|916.15|2014-03-28|Reliance outbids international oil & gas majors to bag two blocks in Myanmar
26.450000000000045|2014-03-31|942.6|2014-04-01|916.15|2014-03-28|Buy Reliance 900 Call, sell two 940 calls: Amit Trivedi
26.450000000000045|2014-03-31|942.6|2014-04-01|916.15|2014-03-28|Deven Choksey positive on Reliance Industries
26.450000000000045|2014-03-31|942.6|2014-04-01|916.15|2014-03-28|Won't sign new gas pact sans govt nod: Fertilizer union
26.450000000000045|2014-03-31|942.6|2014-04-01|916.15|2014-03-28|Go long in Reliance Industries: Siddharth Bhamre
27.450000000000045|2014-04-01|958.2|2014-04-02|930.75|2014-03-31|Higher gas price would push working cap by Rs 1k cr: RCF
27.450000000000045|2014-04-01|958.2|2014-04-02|930.75|2014-03-31|Hold Reliance Industries: Siddharth Bhamre
10.049999999999955|2014-04-02|952.65|2014-04-03|942.6|2014-04-01|SC withdraws Spigelman as arbitrator in RIL-Centre dispute
10.049999999999955|2014-04-02|952.65|2014-04-03|942.6|2014-04-01|Buy Reliance Industries, advises Sudarshan Sukhani
10.049999999999955|2014-04-02|952.65|2014-04-03|942.6|2014-04-01|See 20% upside in Reliance Industries: Rajen Shah
10.049999999999955|2014-04-02|952.65|2014-04-03|942.6|2014-04-01|EDC provides USD 500mn financing to Reliance Industries
-13.950000000000045|2014-04-03|944.25|2014-04-04|958.2|2014-04-02|Buy Reliance Industries, says Ambareesh Baliga
-13.950000000000045|2014-04-03|944.25|2014-04-04|958.2|2014-04-02|Top 10 stocks to make your portfolio shine today
-13.950000000000045|2014-04-03|944.25|2014-04-04|958.2|2014-04-02|Pick BPCL, advises Krish Subramanium
-8.5|2014-04-04|944.15|2014-04-07|952.65|2014-04-03|Buy Reliance Industries at lower levels: Deven Choksey
17.899999999999977|2014-04-07|962.15|2014-04-09|944.25|2014-04-04|RCom, Reliance Jio sign intra-city infra sharing pact
17.899999999999977|2014-04-07|962.15|2014-04-09|944.25|2014-04-04|Buy Reliance Industries: Ambareesh Baliga
17.899999999999977|2014-04-07|962.15|2014-04-09|944.25|2014-04-04|Buy Reliance Industries: Sudarshan Sukhani
17.899999999999977|2014-04-07|962.15|2014-04-09|944.25|2014-04-04|Reliance Industries or IndiaWin Sports not a bidder for any franchise in ISL
17.899999999999977|2014-04-07|962.15|2014-04-09|944.25|2014-04-04|Reliance Jio, Rel Comm in master services pact
18.0|2014-04-08|962.15|2014-04-09|944.15|2014-04-07|Oil regulator seeks consultants to set RIL marketing margin
24.899999999999977|2014-04-09|969.05|2014-04-10|944.15|2014-04-07|Enter Reliance Industries on dips: Anu Jain
24.899999999999977|2014-04-09|969.05|2014-04-10|944.15|2014-04-07|Buy Reliance Industries: Regan Homavazir
24.899999999999977|2014-04-09|969.05|2014-04-10|944.15|2014-04-07|RIL says new gas rates to be effective April 1
-8.399999999999977|2014-04-10|953.75|2014-04-11|962.15|2014-04-09|Reliance Industries may go above Rs 1000: Prakash Diwan
-8.399999999999977|2014-04-10|953.75|2014-04-11|962.15|2014-04-09|India telcos: When will men separate from boys?
-8.399999999999977|2014-04-10|953.75|2014-04-11|962.15|2014-04-09|Reliance Industries likely to outperform: Abhijit Paul
-19.949999999999932|2014-04-11|949.1|2014-04-15|969.05|2014-04-10|Reliance Industries' FY14 results on April 18, 2014
-19.949999999999932|2014-04-11|949.1|2014-04-15|969.05|2014-04-10|Reliance Industries may test Rs 1050: Nischal Maheshwari
-12.450000000000045|2014-04-15|941.3|2014-04-16|953.75|2014-04-11|Reliance's polyester plant at Silvassa starts production
-12.450000000000045|2014-04-15|941.3|2014-04-16|953.75|2014-04-11|OilMin to move Cabinet to allow RIL to retain gas finds 
10.0|2014-04-16|959.1|2014-04-17|949.1|2014-04-15|Enter Reliance Industries: Sudarshan Sukhani
10.0|2014-04-16|959.1|2014-04-17|949.1|2014-04-15|Avoid Cairn India, prefer ONGC, Reliance: Sudarshan Sukhani
10.0|2014-04-16|959.1|2014-04-17|949.1|2014-04-15|SC to resume hearing in KG-D6 gas case on Tuesday
18.300000000000068|2014-04-17|959.6|2014-04-21|941.3|2014-04-16|Reliance Industries may test Rs 1150-1200: Ambareesh Baliga
18.300000000000068|2014-04-17|959.6|2014-04-21|941.3|2014-04-16|Top 10 stocks: Focus on RIL, HCL, Bajaj Auto, USL
18.300000000000068|2014-04-17|959.6|2014-04-21|941.3|2014-04-16|Reliance Industries may test Rs 1000: Sudarshan Sukhani
18.300000000000068|2014-04-17|959.6|2014-04-21|941.3|2014-04-16|Reliance Ind Q4 net may rise 1% at Rs 5652cr: Motilal Oswal
18.300000000000068|2014-04-17|959.6|2014-04-21|941.3|2014-04-16|Reliance Industries Q4 PAT seen up at Rs 5613.4cr: Emkay
18.300000000000068|2014-04-17|959.6|2014-04-21|941.3|2014-04-16|Reliance Industries Q4 PAT may fall at Rs 5557cr: Sharekhan
18.300000000000068|2014-04-17|959.6|2014-04-21|941.3|2014-04-16|Analysts expect Reliance to post Q4 net at Rs 5655 cr: Poll
18.300000000000068|2014-04-17|959.6|2014-04-21|941.3|2014-04-16|Oil Min seeks legal opinion on BP arbitration notice
0.5|2014-04-18|959.6|2014-04-21|959.1|2014-04-17|RIL Q4 net up 2% at Rs 5631 cr, GRM rises 22% to $9.3/bbl
0.5|2014-04-19|959.6|2014-04-21|959.1|2014-04-17|Reliance Industries announces Q4 results; PAT at Rs 5631cr
0.5|2014-04-19|959.6|2014-04-21|959.1|2014-04-17|How to play Reliance Industries after its Q4 results?
0.5|2014-04-19|959.6|2014-04-21|959.1|2014-04-17|RIL to invest up to USD 700 mn in shale gas venture
0.5|2014-04-19|959.6|2014-04-21|959.1|2014-04-17|Reliance Industries recommends dividend of Rs 9.50/share
0.5|2014-04-19|959.6|2014-04-21|959.1|2014-04-17|Hold RIL for long term, may move to Rs 1000: JM Financial
0.5|2014-04-19|959.6|2014-04-21|959.1|2014-04-17|Reliance Industries top buy: Prayesh Jain
0.5|2014-04-19|959.6|2014-04-21|959.1|2014-04-17|Reliance Industries may touch Rs 1050: Prakash Diwan
8.649999999999977|2014-04-21|967.75|2014-04-22|959.1|2014-04-17|Accumulate HCL Tech, Reliance Industries: Angel Broking
8.649999999999977|2014-04-21|967.75|2014-04-22|959.1|2014-04-17|Buy Reliance Industries: Nischal Maheshwari
8.649999999999977|2014-04-21|967.75|2014-04-22|959.1|2014-04-17|How Reliance became India's top retailer
8.649999999999977|2014-04-21|967.75|2014-04-22|959.1|2014-04-17|RIL telecoms unit in tower lease pact with ATC
8.649999999999977|2014-04-21|967.75|2014-04-22|959.1|2014-04-17|Reliance Industries may test Rs 1175-1200: Ambareesh Baliga
8.649999999999977|2014-04-21|967.75|2014-04-22|959.1|2014-04-17|Hold Reliance Industries: Sangeeta Purushottam
8.649999999999977|2014-04-21|967.75|2014-04-22|959.1|2014-04-17|RIL to continue to post higher GRMs in FY15-16: Religare
8.649999999999977|2014-04-21|967.75|2014-04-22|959.1|2014-04-17|Reliance Jio, ATC India sign tower-infra sharing pact
8.649999999999977|2014-04-21|967.75|2014-04-22|959.1|2014-04-17|Reliance inaugurates its Elastomers Customer Support Centre at Vadodara
8.649999999999977|2014-04-21|967.75|2014-04-22|959.1|2014-04-17|Prefer Reliance Industries on dips: Nitin Tiwari
7.5499999999999545|2014-04-22|967.15|2014-04-23|959.6|2014-04-21|Buy Reliance Industries, advises Kunal Saraogi
7.5499999999999545|2014-04-22|967.15|2014-04-23|959.6|2014-04-21|Emkay reviews 5 largecap stocks post Q4FY14 results
-19.5|2014-04-23|948.25|2014-04-25|967.75|2014-04-22|RIL signs loan for up to USD 550mn, co-financed by Japanese banks
-19.5|2014-04-23|948.25|2014-04-25|967.75|2014-04-22|See upside in Reliance Industries: Anish Damania
-19.5|2014-04-23|948.25|2014-04-25|967.75|2014-04-22|RIL raises USD 550 m from Japanese banks
-9.200000000000045|2014-04-29|935.8|2014-04-30|945.0|2014-04-28|SC appoints ex Aussie judge as arbitrator between RIL-govt
-12.199999999999932|2014-04-30|928.1|2014-05-02|940.3|2014-04-29|Buy Reliance Industries, says Sudarshan Sukhani
-12.199999999999932|2014-04-30|928.1|2014-05-02|940.3|2014-04-29|Anish Damania neutral on oil & gas space
11.050000000000068|2014-05-02|946.85|2014-05-05|935.8|2014-04-30|Reliance Industries fixes book closure for dividend
11.050000000000068|2014-05-02|946.85|2014-05-05|935.8|2014-04-30|India orders gas price rises be backdated to April 1
11.050000000000068|2014-05-02|946.85|2014-05-05|935.8|2014-04-30|Buy Reliance Industries at around Rs 935-950: Abhijit Paul
18.75|2014-05-03|946.85|2014-05-05|928.1|2014-05-02|Sanjeev Prasad positive on Reliance Industries
35.25|2014-05-05|963.35|2014-05-06|928.1|2014-05-02|Buy Reliance Inds; target of Rs 1050: Firstcall Research 
35.25|2014-05-05|963.35|2014-05-06|928.1|2014-05-02|Reliance Industries may hit Rs 1175-1200: Ambareesh Baliga
35.25|2014-05-05|963.35|2014-05-06|928.1|2014-05-02|Reliance Industries may touch Rs 1000: Sudarshan Sukhani
14.0|2014-05-06|960.85|2014-05-07|946.85|2014-05-05|Super Six short term picks for May 6
14.0|2014-05-06|960.85|2014-05-07|946.85|2014-05-05|Top 10: Stocks to focus on May 6
14.0|2014-05-06|960.85|2014-05-07|946.85|2014-05-05|Buy Reliance Industries, advises Kunj Bansal
36.75|2014-05-08|997.6|2014-05-09|960.85|2014-05-07|Buy BPCL on dips: Sudarshan Sukhani
36.75|2014-05-08|997.6|2014-05-09|960.85|2014-05-07|Invest in Reliance Industries, says Baliga
36.75|2014-05-08|997.6|2014-05-09|960.85|2014-05-07|See limited downside in oil & gas stocks: Anup Bagchi
36.75|2014-05-08|997.6|2014-05-09|960.85|2014-05-07|Prefer ONGC, Reliance: Sudarshan Sukhani
68.40000000000009|2014-05-09|1028.7|2014-05-12|960.3|2014-05-08|Buy ONGC, Reliance Industries: Deven Choksey
31.100000000000023|2014-05-10|1028.7|2014-05-12|997.6|2014-05-09|Reliance Industries: Media Statement
31.100000000000023|2014-05-10|1028.7|2014-05-12|997.6|2014-05-09|RIL serves arbitration notice to govt on gas pricing issue
31.100000000000023|2014-05-11|1028.7|2014-05-12|997.6|2014-05-09|Gas price revision delay may stall $4 bn investment: RIL
65.80000000000007|2014-05-12|1063.4|2014-05-13|997.6|2014-05-09|Reliance Industries may touch Rs 1140: Pritesh Mehta
65.80000000000007|2014-05-12|1063.4|2014-05-13|997.6|2014-05-09|Hold Reliance Industries, advises Sudarshan Sukhani
65.80000000000007|2014-05-12|1063.4|2014-05-13|997.6|2014-05-09|Buy RIL 980 Call, sell 1040 Call: Krish Subramanium
65.80000000000007|2014-05-12|1063.4|2014-05-13|997.6|2014-05-09|Reliance Industries may go up to Rs 1060-1070: Jai Bala
65.80000000000007|2014-05-12|1063.4|2014-05-13|997.6|2014-05-09|Reliance Industries may test Rs 1050-1080: Hemant Thukral
65.80000000000007|2014-05-12|1063.4|2014-05-13|997.6|2014-05-09|RIL, BP and NIKO issue notice of arbitration to Government of India
-10.0|2014-05-14|1053.4|2014-05-15|1063.4|2014-05-13|Reliance Industries may test Rs 1100-1120: Amit Gupta
-10.0|2014-05-14|1053.4|2014-05-15|1063.4|2014-05-13|Reliance Industries: Updates on change in date of AGM & payment of dividend
-10.0|2014-05-14|1053.4|2014-05-15|1063.4|2014-05-13|New gas rates to be applicable from Apr 1: RIL to buyers
33.75|2014-05-15|1079.25|2014-05-16|1045.5|2014-05-14|RJio signs mobile tower pact with Tower Vision
66.64999999999986|2014-05-16|1120.05|2014-05-19|1053.4|2014-05-15|Bull's Eye: Buy Sadbhav Engg, Reliance Ind; sell Arvind
66.64999999999986|2014-05-16|1120.05|2014-05-19|1053.4|2014-05-15|Reliance Jio and Tower Vision sign tower infrastructure sharing agreement
66.64999999999986|2014-05-16|1120.05|2014-05-19|1053.4|2014-05-15|Nita Ambani to be appointed to Reliance Industries board
40.799999999999955|2014-05-17|1120.05|2014-05-19|1079.25|2014-05-16|Reliance Industries recommends appointment of Nita Ambani as director
0.599999999999909|2014-05-19|1079.85|2014-05-20|1079.25|2014-05-16|Anish Damania overweight on oil & gas sector
0.599999999999909|2014-05-19|1079.85|2014-05-20|1079.25|2014-05-16|Sharekhan advises 20 midcaps for 40% returns
-41.649999999999864|2014-05-20|1078.4|2014-05-21|1120.05|2014-05-19|Buy Reliance Industries; target of Rs 1325: ICICIdirect
20.950000000000045|2014-05-21|1100.8|2014-05-22|1079.85|2014-05-20|Mukesh Ambani keeps salary capped at Rs 15cr for 6th year
49.049999999999955|2014-05-22|1127.45|2014-05-23|1078.4|2014-05-21|Buy Reliance Industries on dips: Sudarshan Sukhani
49.049999999999955|2014-05-22|1127.45|2014-05-23|1078.4|2014-05-21|Reliance Industries: AGM on June 18, 2014
49.049999999999955|2014-05-22|1127.45|2014-05-23|1078.4|2014-05-21|Reliance Retail to foray into e-commerce this year
49.049999999999955|2014-05-22|1127.45|2014-05-23|1078.4|2014-05-21|RIL plans to raise up to Rs 10,000 cr in debt
0.900000000000091|2014-05-23|1101.7|2014-05-26|1100.8|2014-05-22|RIL fires fresh salvo at ONGC, denies gas theft allegation
-39.5|2014-05-26|1087.95|2014-05-27|1127.45|2014-05-23|Motilal Oswal neutral on Reliance Industries; target Rs 972
-39.5|2014-05-26|1087.95|2014-05-27|1127.45|2014-05-23|Reliance Industries may test Rs 1175-1200: Ambareesh Baliga
-12.799999999999955|2014-05-27|1088.9|2014-05-28|1101.7|2014-05-26|Prefer Reliance Industries on dips: Neeraj Deewan
17.5|2014-06-01|1082.2|2014-06-02|1064.7|2014-05-30|RIL rejigs investment portfolio; focus on bonds, deposits
32.75|2014-06-06|1122.65|2014-06-09|1089.9|2014-06-05|Buy Reliance Industries 1100 Call: VK Sharma
-24.149999999999864|2014-06-11|1094.15|2014-06-12|1118.3|2014-06-10|Buy Reliance Industires, may touch Rs 1250: Kunal Saraogi
-24.149999999999864|2014-06-11|1094.15|2014-06-12|1118.3|2014-06-10|Invest in Tata Steel, Tata Motors, Reliance Ind: Joshi
-20.199999999999818|2014-06-12|1081.9|2014-06-13|1102.1|2014-06-11|Prefer RIL, SBI, L&T on dips: Ambareesh Baliga
-28.700000000000045|2014-06-13|1065.45|2014-06-16|1094.15|2014-06-12|Buy Reliance Industries, Bajaj Auto: Deven Choksey
-16.450000000000045|2014-06-14|1065.45|2014-06-16|1081.9|2014-06-13|Buy Reliance Industries, says CK Narayan
-47.950000000000045|2014-06-18|1042.1|2014-06-19|1090.05|2014-06-17|Buy ONGC, GAIL, RIL on correction: Sukhani
-47.950000000000045|2014-06-18|1042.1|2014-06-19|1090.05|2014-06-17|Live Updates: Rel Jio's expanded field trials will start in Aug 2014: RIL
-47.950000000000045|2014-06-18|1042.1|2014-06-19|1090.05|2014-06-17|Reliance to invest Rs 1.8 lakh cr in 3 years: Mukesh Ambani
-47.950000000000045|2014-06-18|1042.1|2014-06-19|1090.05|2014-06-17|Key takeaways from Reliance's 40th Annual General Meet
-30.25|2014-06-19|1036.5|2014-06-20|1066.75|2014-06-18|3 reasons why investors need to hold Reliance for payback
-30.25|2014-06-19|1036.5|2014-06-20|1066.75|2014-06-18|Reliance Industries appoints Nita Ambani as director 
-30.25|2014-06-19|1036.5|2014-06-20|1066.75|2014-06-18|Motilal Oswal neutral on Reliance Industries; target Rs 972
-4.149999999999864|2014-06-20|1037.95|2014-06-23|1042.1|2014-06-19|Buy ONGC, RIL: Deven Choksey
13.049999999999955|2014-06-24|1051.0|2014-06-25|1037.95|2014-06-23|6 stocks likely to see lot of action today
13.049999999999955|2014-06-24|1051.0|2014-06-25|1037.95|2014-06-23|Bull's Eye: Buy LIC Housing, YES Bank, BOI, Lupin, Reliance
13.049999999999955|2014-06-24|1051.0|2014-06-25|1037.95|2014-06-23|Prefer Reliance Industries: Sandeep Shenoy
13.049999999999955|2014-06-24|1051.0|2014-06-25|1037.95|2014-06-23|Buy Firstsource, Motherson Sumi, Reliance Ind: Vishal Jajoo
13.049999999999955|2014-06-24|1051.0|2014-06-25|1037.95|2014-06-23|Remain invested in Reliance Industries: SP Tulsian
-47.94999999999993|2014-06-25|1011.9|2014-06-26|1059.85|2014-06-24|Stay with Reliance Industries, says Mayuresh Joshi
-47.94999999999993|2014-06-25|1011.9|2014-06-26|1059.85|2014-06-24|Hold Reliance Industries, says Vishal Malkan
-47.94999999999993|2014-06-25|1011.9|2014-06-26|1059.85|2014-06-24|Buy Reliance Industries; target of Rs 1190: Sharekhan
-38.89999999999998|2014-06-26|1012.1|2014-06-27|1051.0|2014-06-25|SAT verdict in RIL insider-trading case on Jun 30
-38.89999999999998|2014-06-26|1012.1|2014-06-27|1051.0|2014-06-25|Buy Reliance Industries, says Siddharth Bhamre
-38.89999999999998|2014-06-26|1012.1|2014-06-27|1051.0|2014-06-25|Buy oil & gas stocks on correction: Sanjay Dutt
-38.89999999999998|2014-06-26|1012.1|2014-06-27|1051.0|2014-06-25|Reliance Industries long term bet: Manish Sonthalia
-38.89999999999998|2014-06-26|1012.1|2014-06-27|1051.0|2014-06-25|Prefer oil & gas stocks for trading: Nilesh Shah
3.5|2014-06-27|1015.4|2014-06-30|1011.9|2014-06-26|Buy ONGC, Reliance Industries: Deven Choksey
-4.100000000000023|2014-06-30|1008.0|2014-07-01|1012.1|2014-06-27|SAT dismisses Reliance Industries appeal on consent order 
-4.100000000000023|2014-06-30|1008.0|2014-07-01|1012.1|2014-06-27|RIL can challenge SAT ruling in HC: Ranina
-36.90000000000009|2014-07-07|995.05|2014-07-08|1031.95|2014-07-04|Super six stocks you can bet on July 7
-36.90000000000009|2014-07-07|995.05|2014-07-08|1031.95|2014-07-04|Reliance Industries has support at Rs 1000: Sukhani
-36.90000000000009|2014-07-07|995.05|2014-07-08|1031.95|2014-07-04|Parekh, Zainulbhai to be independent directors in Network18
-36.90000000000009|2014-07-07|995.05|2014-07-08|1031.95|2014-07-04|Eight Indian companies in Fortune 500 list
-26.25|2014-07-08|1000.95|2014-07-09|1027.2|2014-07-07|Independent Media Trust completes acquisition of control of Network18
2.150000000000091|2014-07-09|997.2|2014-07-10|995.05|2014-07-08|Reliance Industries' updates on outcome of AGM
-35.450000000000045|2014-07-11|961.75|2014-07-14|997.2|2014-07-10|Reliance Industries' Q1 results on July 19, 2014
-4.75|2014-07-12|961.75|2014-07-14|966.5|2014-07-11|Buy oil & gas stocks on 8-10% correction: Vibhav Kapoor
5.7000000000000455|2014-07-14|972.2|2014-07-15|966.5|2014-07-11|Budget fails to fuel oil & gas sector; time to book-out?
5.7000000000000455|2014-07-14|972.2|2014-07-15|966.5|2014-07-11|Govt slaps $579m additional penalty on RIL
10.299999999999955|2014-07-16|982.5|2014-07-17|972.2|2014-07-15|Buy Reliance as tactical call on valuations: Sanjeev Prasad
10.299999999999955|2014-07-16|982.5|2014-07-17|972.2|2014-07-15|Oil Min to move Cabinet to allow RIL to retain gas finds
-12.950000000000045|2014-07-17|976.75|2014-07-18|989.7|2014-07-16|Buy Reliance Industries on declines: Sudarshan Sukhani
20.899999999999977|2014-07-19|997.65|2014-07-21|976.75|2014-07-18|How will Reliance nos impact stock? Experts discuss
20.899999999999977|2014-07-19|997.65|2014-07-21|976.75|2014-07-18|RIL Q1 net up 13.7% to Rs 5957 cr, beats analyst estimates
20.899999999999977|2014-07-20|997.65|2014-07-21|976.75|2014-07-18|FIIs up stake in RIL to 7-year high at about 20%
20.899999999999977|2014-07-20|997.65|2014-07-21|976.75|2014-07-18|Mid-cycle performance of refining, petchem lift RIL Q1: CFO
54.200000000000045|2014-07-21|1030.95|2014-07-22|976.75|2014-07-18|RIL, BP relinquish yet another gas block
54.200000000000045|2014-07-21|1030.95|2014-07-22|976.75|2014-07-18|Where Reliance's next billion-dollar profits will come from
54.200000000000045|2014-07-21|1030.95|2014-07-22|976.75|2014-07-18|Expect RIL's petchem margins to improve going ahead: IIFL
54.200000000000045|2014-07-21|1030.95|2014-07-22|976.75|2014-07-18|Buy Reliance Industries 980 Call, says VK Sharma
54.200000000000045|2014-07-21|1030.95|2014-07-22|976.75|2014-07-18|Hold Reliance Industries; tgt of Rs 950: Religare Capital
35.60000000000002|2014-07-22|1033.25|2014-07-23|997.65|2014-07-21|LKP neutral on Reliance Industries
35.60000000000002|2014-07-22|1033.25|2014-07-23|997.65|2014-07-21|Motilal Oswal neutral on Reliance Industries
35.60000000000002|2014-07-22|1033.25|2014-07-23|997.65|2014-07-21|Buy Reliance Industries, advises Manas Jaiswal
35.60000000000002|2014-07-22|1033.25|2014-07-23|997.65|2014-07-21|RIL's Q1 performance supports credit profile: Moody's
10.099999999999909|2014-07-23|1041.05|2014-07-24|1030.95|2014-07-22|Buy Reliance Industries; target of Rs 1190: Sharekhan
-35.44999999999993|2014-07-25|1005.6|2014-07-28|1041.05|2014-07-24|Bull's Eye: Buy Wockhardt, Just Dial, Infosys, Siemens
-35.44999999999993|2014-07-25|1005.6|2014-07-28|1041.05|2014-07-24|Buy Reliance Industries 1040 Call: VK Sharma
-35.44999999999993|2014-07-25|1005.6|2014-07-28|1041.05|2014-07-24|Buy HCL Infosystems, Wockhardt, Vardhman Tex, RIL: Merani
-35.44999999999993|2014-07-25|1005.6|2014-07-28|1041.05|2014-07-24|Buy Petronet LNG, advises Siddharth Bhamre
0.8500000000000227|2014-07-30|1006.45|2014-07-31|1005.6|2014-07-28|Buy Reliance Industries; target of Rs 1192: KRChoksey
-29.850000000000023|2014-07-31|976.3|2014-08-01|1006.15|2014-07-30|Positive on Tata Global, HDFC Bank, RIL: Amit Harchekar
-29.850000000000023|2014-07-31|976.3|2014-08-01|1006.15|2014-07-30|RIL may touch Rs 1070-1075: Amit Harchekar
8.700000000000045|2014-08-03|985.0|2014-08-04|976.3|2014-08-01|Top-nine firms lose Rs 74,193 cr from market valuation
8.700000000000045|2014-08-03|985.0|2014-08-04|976.3|2014-08-01|DGH rejects ONGC's three KG gas discoveries
7.550000000000068|2014-08-04|983.85|2014-08-05|976.3|2014-08-01|Buy oil & gas stocks, says Sudarshan Sukhani
3.1499999999999773|2014-08-05|988.15|2014-08-06|985.0|2014-08-04|Oil & gas, banks stocks to outperform: Sanjay Dutt
3.1499999999999773|2014-08-05|988.15|2014-08-06|985.0|2014-08-04|Super Six stocks you can bet on August 5
5.449999999999932|2014-08-06|989.3|2014-08-07|983.85|2014-08-05|Buy Reliance Industries: Sudarshan Sukhani
-7.649999999999977|2014-08-07|980.5|2014-08-08|988.15|2014-08-06|Prefer Reliance Industries: Hemen Kapadia
-7.649999999999977|2014-08-07|980.5|2014-08-08|988.15|2014-08-06|Here's what experts suggest for TCS, Jubilant Foodworks now
-8.799999999999955|2014-08-08|980.5|2014-08-11|989.3|2014-08-07|Buy Reliance Industries below Rs 960: Deven Choksey
-8.799999999999955|2014-08-08|980.5|2014-08-11|989.3|2014-08-07|Buy Divis Labs, Lupin, Reliance Industries: Dilip Bhat
3.8999999999999773|2014-08-11|984.4|2014-08-12|980.5|2014-08-08|To see Africa biz improve by FY15: Bharti's Akhil Gupta
18.550000000000068|2014-08-13|1002.95|2014-08-14|984.4|2014-08-12|RIL asks SC to appoint 3rd independent arbitrator
18.550000000000068|2014-08-13|1002.95|2014-08-14|984.4|2014-08-12|Prefer oil & gas stocks: Sudarshan Sukhani
18.550000000000068|2014-08-13|1002.95|2014-08-14|984.4|2014-08-12|Vineet Bhatnagar positive on Exide, Reliance Industries
22.899999999999977|2014-08-14|1013.05|2014-08-18|990.15|2014-08-13|How Macquarie Cap reads Q1 earnings season so far
6.349999999999909|2014-08-18|1009.3|2014-08-19|1002.95|2014-08-14|How did first quarter earnings look? 'Good but not great'
-14.699999999999932|2014-08-19|998.35|2014-08-20|1013.05|2014-08-18|Go long in Reliance Industries: Sudarshan Sukhani
-14.199999999999932|2014-08-20|995.1|2014-08-21|1009.3|2014-08-19|Invest in Reliance Industries, says Rajen Shah
-2.5|2014-08-23|995.8|2014-08-25|998.3|2014-08-22|Buy oil & gas stocks on corrections: Sandeep Shah
-4.949999999999932|2014-08-25|993.35|2014-08-26|998.3|2014-08-22|RIL to use US ethane instead of costly naphtha: Edelweiss
5.350000000000023|2014-08-27|998.7|2014-08-28|993.35|2014-08-26|Buy ONGC, Reliance Industries: Sudarshan Sukhani
5.350000000000023|2014-08-27|998.7|2014-08-28|993.35|2014-08-26|RIL to save $450 mn/yr by importing ethane from US
20.399999999999977|2014-08-28|1014.1|2014-09-01|993.7|2014-08-27|Reliance Industries, ONGC top picks: Gautam Chhaochharia
25.09999999999991|2014-09-01|1023.8|2014-09-02|998.7|2014-08-28|Reliance Industries may cross Rs 1100: Sudarshan Sukhani
