Difference|date|nextClose|nextDay|prevClose|prevDay|text
-6.800000000000068|2012-08-29|783.4|2012-08-30|790.2|2012-08-28|OVL in talks to buy shale gas assets in US, Canada
-15.75|2012-08-30|766.4|2012-08-31|782.15|2012-08-29|Grasim, RIL, GAIL may see some selling pressure: Agarwal
-15.75|2012-08-30|766.4|2012-08-31|782.15|2012-08-29|Buy Reliance Inds on dips; sell Infosys on rally: Bhamre
-15.75|2012-08-30|766.4|2012-08-31|782.15|2012-08-29|RIL submits revised proposal for 2 gas discoveries
-20.350000000000023|2012-08-31|763.05|2012-09-03|783.4|2012-08-30|Citi downgrades RIL to 'neutral' on earnings outlook
-20.350000000000023|2012-08-31|763.05|2012-09-03|783.4|2012-08-30|Buy Reliance Industries around Rs 765: SP Tulsian
13.200000000000045|2012-09-03|779.6|2012-09-04|766.4|2012-08-31|Reliance Industries has target of Rs 745: Thukral
13.200000000000045|2012-09-03|779.6|2012-09-04|766.4|2012-08-31|Short Hero Motocorp, Reliance Industries: Sukhani
8.100000000000023|2012-09-04|771.15|2012-09-05|763.05|2012-09-03|Short RIL, Bharti Airtel: Sukhani
8.100000000000023|2012-09-04|771.15|2012-09-05|763.05|2012-09-03|CAG raps ONGC for hiring RIL drilling rig without bidding
-11.399999999999977|2012-09-05|768.2|2012-09-06|779.6|2012-09-04|Crompton Greaves can go below Rs 100: Sukhani
-11.399999999999977|2012-09-05|768.2|2012-09-06|779.6|2012-09-04|RIL refining cycle outlook subdued: Kotak Securities
20.600000000000023|2012-09-06|791.75|2012-09-07|771.15|2012-09-05|RIL gets listed on Dubai Mercantile Exchange
20.600000000000023|2012-09-06|791.75|2012-09-07|771.15|2012-09-05|RIL becomes Dubai Mercantile Exchange member
27.799999999999955|2012-09-07|796.0|2012-09-08|768.2|2012-09-06|CLSA says underweight trade on RIL over
27.799999999999955|2012-09-07|796.0|2012-09-08|768.2|2012-09-06|RIL to remain underperformer: Sudarshan Sukhani
0.2999999999999545|2012-09-08|792.05|2012-09-10|791.75|2012-09-07|Tata Motors has target of Rs 270, says Sukhani
-5.0|2012-09-10|791.0|2012-09-11|796.0|2012-09-08|Reliance Industries has target of Rs 850: Sukhani
-5.0|2012-09-10|791.0|2012-09-11|796.0|2012-09-08|RIL-Hardy Oil to relinquish NEC blocks: Sources
6.050000000000068|2012-09-11|798.1|2012-09-12|792.05|2012-09-10|RIL to exit almost all overseas oil & gas blocks: Sources
6.050000000000068|2012-09-11|798.1|2012-09-12|792.05|2012-09-10|Buy Balrampur Chini, RIL, ONGC: Sukhani
8.149999999999977|2012-09-12|799.15|2012-09-13|791.0|2012-09-11|RIL plans new gas well; conversion of 2 oil wells into gas
8.149999999999977|2012-09-12|799.15|2012-09-13|791.0|2012-09-11|Buy TCS, Reliance Industries, says Sudarshan Sukhani
8.149999999999977|2012-09-12|799.15|2012-09-13|791.0|2012-09-11|Govt may disallow E&P cos to recover costs on dry wells
43.64999999999998|2012-09-13|841.75|2012-09-14|798.1|2012-09-12|Oil Min to allow exploration wells with conditions
74.60000000000002|2012-09-14|873.75|2012-09-17|799.15|2012-09-13|Buy Reliance Industries on dips, says Shardul Kulkarni
74.60000000000002|2012-09-14|873.75|2012-09-17|799.15|2012-09-13|6 intraday picks to make smart gains
74.60000000000002|2012-09-14|873.75|2012-09-17|799.15|2012-09-13|Sukhani upbeat on banking sector
32.0|2012-09-16|873.75|2012-09-17|841.75|2012-09-14|RIL plans low-cost telecom towers costing just Rs 1 lakh
13.850000000000023|2012-09-17|855.6|2012-09-18|841.75|2012-09-14|RIL seeks 3-fold rise in KG-D6 gas price from April '14
13.850000000000023|2012-09-17|855.6|2012-09-18|841.75|2012-09-14|RIL share value surpasses maximum buyback price
13.850000000000023|2012-09-17|855.6|2012-09-18|841.75|2012-09-14|Top 100 companies pay 10% more in advance tax in Q2
-41.25|2012-09-18|832.5|2012-09-20|873.75|2012-09-17|SP Tulsian cautious on Reliance Industries
-41.25|2012-09-18|832.5|2012-09-20|873.75|2012-09-17|UBS India is bullish on Reliance Industries
-41.25|2012-09-18|832.5|2012-09-20|873.75|2012-09-17|Hold REC, target of Rs 230-240: Sukhani
-41.25|2012-09-18|832.5|2012-09-20|873.75|2012-09-17|Book profit in Pantaloon, says Sukhani
-5.300000000000068|2012-09-20|850.3|2012-09-21|855.6|2012-09-18|RIL rally unjustified; cut to 'sell' from 'reduce': Kotak
-5.300000000000068|2012-09-20|850.3|2012-09-21|855.6|2012-09-18|Reliance Industries may slip to Rs 800- 810: SP Tulsian
-5.300000000000068|2012-09-20|850.3|2012-09-21|855.6|2012-09-18|Reliance Industries can test Rs 900: Sukhani
3.8500000000000227|2012-09-21|836.35|2012-09-24|832.5|2012-09-20|Reliance Industries may slip to Rs 800-810: SP Tulsian
-13.949999999999932|2012-09-23|836.35|2012-09-24|850.3|2012-09-21|Natural gas prices should be determined by market forces
8.399999999999977|2012-09-25|844.75|2012-09-26|836.35|2012-09-24|RIL likely to bid for telecom spectrum
8.399999999999977|2012-09-25|844.75|2012-09-26|836.35|2012-09-24|ONGC studying CAG report
8.399999999999977|2012-09-25|844.75|2012-09-26|836.35|2012-09-24|Accumulate Reliance Industries around Rs 810- 815: Kulkarni
8.399999999999977|2012-09-25|844.75|2012-09-26|836.35|2012-09-24|HUL may slip, RIL can touch Rs 854: Mehta
-9.899999999999977|2012-09-26|829.85|2012-09-27|839.75|2012-09-25|Cement sector may be market flavor for Oct series: Tulsian
-9.899999999999977|2012-09-26|829.85|2012-09-27|839.75|2012-09-25|Bharti Airtel, Idea fall; rally seen unjustified
-7.5499999999999545|2012-09-27|837.2|2012-09-28|844.75|2012-09-26|RIL signs 15 year oil contract with PDVSA; stock down
-7.5499999999999545|2012-09-27|837.2|2012-09-28|844.75|2012-09-26|Book profits in RIL around Rs 850-855: Hemant Thukral
3.6499999999999773|2012-09-28|833.5|2012-10-01|829.85|2012-09-27|RIL wants oil min to re-think on new exploration policy
3.6499999999999773|2012-09-28|833.5|2012-10-01|829.85|2012-09-27|RIL protests against newly-proposed exploration law
-3.7000000000000455|2012-09-30|833.5|2012-10-01|837.2|2012-09-28|RIL seeks nod for plan to triple gas prices from Apr 2014
8.899999999999977|2012-10-01|846.1|2012-10-03|837.2|2012-09-28|Positive on cement sector for next 6 months: Tulsian
8.899999999999977|2012-10-01|846.1|2012-10-03|837.2|2012-09-28|Exit Reliance Industries around Rs 850: SP Tulsian
12.600000000000023|2012-10-02|846.1|2012-10-03|833.5|2012-10-01|RIL contests CAG's powers to audit KG-D6 field
19.399999999999977|2012-10-03|852.9|2012-10-04|833.5|2012-10-01|RIL to oil min: Allow capex to avoid closure of KG-D6
19.399999999999977|2012-10-03|852.9|2012-10-04|833.5|2012-10-01|RIL signs agmt with Venezuela for heavy oil project
19.399999999999977|2012-10-03|852.9|2012-10-04|833.5|2012-10-01|RIL can go upto Rs 900: Kulkarni
19.399999999999977|2012-10-03|852.9|2012-10-04|833.5|2012-10-01|Cement, insurance stocks top Tulsian's bets
11.699999999999932|2012-10-04|857.8|2012-10-05|846.1|2012-10-03|Reliance Industries looks strong: Jai Bala
11.699999999999932|2012-10-04|857.8|2012-10-05|846.1|2012-10-03|Gas pricing should be market driven, say experts
11.699999999999932|2012-10-04|857.8|2012-10-05|846.1|2012-10-03|RIL can touch Rs 900: Kulkarni
11.699999999999932|2012-10-04|857.8|2012-10-05|846.1|2012-10-03|Reliance Industries top pick in large cap space: Kulkarni
11.699999999999932|2012-10-04|857.8|2012-10-05|846.1|2012-10-03|Pension, pharma reforms vital; realty to rally on: Tulsian
11.699999999999932|2012-10-04|857.8|2012-10-05|846.1|2012-10-03|Cabinet clears 49% FDI in insurance and pension
-38.39999999999998|2012-10-07|819.4|2012-10-08|857.8|2012-10-05|RIL refuses OilMin order to swap KG-D6 gas with Andhra firm
-42.5|2012-10-08|815.3|2012-10-09|857.8|2012-10-05|Morgan Stanley cuts RIL to 'underweight' on outlook
-42.5|2012-10-08|815.3|2012-10-09|857.8|2012-10-05|Sell Reliance Industries: Sukhani
-42.5|2012-10-08|815.3|2012-10-09|857.8|2012-10-05|Reliance Industries tanks on Morgan Stanley downgrade
-42.5|2012-10-08|815.3|2012-10-09|857.8|2012-10-05|RIL scales down KG-D6 spend by almost USD 3 bn
-42.5|2012-10-08|815.3|2012-10-09|857.8|2012-10-05|Avoid Bharti and Idea: Tulsian 
-42.5|2012-10-08|815.3|2012-10-09|857.8|2012-10-05|Oil ministry to reallocate gas from RIL's KGD6: Sources
-42.5|2012-10-08|815.3|2012-10-09|857.8|2012-10-05|RIL's key gas fields may run out in 5 yrs: Analysts
-42.5|2012-10-08|815.3|2012-10-09|857.8|2012-10-05|Buy Bharti Airtel around Rs 240-245: Baliga
-42.5|2012-10-08|815.3|2012-10-09|857.8|2012-10-05|Reliance Industries Q2 results on Oct 15, 2012
-3.3999999999999773|2012-10-09|816.0|2012-10-10|819.4|2012-10-08|RIL, BP warn of shutting down KG-D6 gas field in 2015-16
-3.3999999999999773|2012-10-09|816.0|2012-10-10|819.4|2012-10-08|Reliance Industries may trade in Rs 770-810 range: Tulsian
-3.3999999999999773|2012-10-09|816.0|2012-10-10|819.4|2012-10-08|RIL may shut KG D6 gas fields in 2015/16: Oil secretary
-3.3999999999999773|2012-10-09|816.0|2012-10-10|819.4|2012-10-08|Rajesh Jain advices to short RIL at current levels
-3.3999999999999773|2012-10-09|816.0|2012-10-10|819.4|2012-10-08|Buy Reliance Industries at Rs 780-800: Siddharth Bhamre
-3.3999999999999773|2012-10-09|816.0|2012-10-10|819.4|2012-10-08|See higher levels in Tata Global Beverage: Sukhani
-3.3999999999999773|2012-10-09|816.0|2012-10-10|819.4|2012-10-08|Wary of IT sector; Bet on L&T, HDIL & cable-TV cos: Tulsian
4.650000000000091|2012-10-10|819.95|2012-10-11|815.3|2012-10-09|Buy RIL around Rs 800; sell on rally to Rs 840: Harchekar
4.650000000000091|2012-10-10|819.95|2012-10-11|815.3|2012-10-09|Exit Reliance Industries: Sukhani
4.650000000000091|2012-10-10|819.95|2012-10-11|815.3|2012-10-09|Power ministry wants priority in gas supply for plants
2.8999999999999773|2012-10-11|818.9|2012-10-12|816.0|2012-10-10|Reliance Industries may not slip below Rs 790-800: Baliga
3.099999999999909|2012-10-12|823.05|2012-10-15|819.95|2012-10-11|Reliance asks govt to end logjam on KGD6 capex plan
3.099999999999909|2012-10-12|823.05|2012-10-15|819.95|2012-10-11|Short Axis Bank with SL of Rs 1114: Datta
3.099999999999909|2012-10-12|823.05|2012-10-15|819.95|2012-10-11|Reliance results may surprise market: Tulsian
3.099999999999909|2012-10-12|823.05|2012-10-15|819.95|2012-10-11|Reliance Inds Q2: Analysts see PAT down 6% at Rs 5365 cr
3.099999999999909|2012-10-12|823.05|2012-10-15|819.95|2012-10-11|SP Tulsian`s view on Reliance Industries
4.149999999999977|2012-10-13|823.05|2012-10-15|818.9|2012-10-12|Fuel subsidy burden may rise to Rs 43654 cr: KR Choksey
4.149999999999977|2012-10-13|823.05|2012-10-15|818.9|2012-10-12|RIL Q2 PAT seen down 5% at Rs 5,419 cr: KR Choksey
4.149999999999977|2012-10-13|823.05|2012-10-15|818.9|2012-10-12|FY13 under-recoveries expected at Rs 1.6 trillion: MOST
4.149999999999977|2012-10-13|823.05|2012-10-15|818.9|2012-10-12|RIL Q2 PAT seen down 2.7% at Rs 5550cr: MOST
4.149999999999977|2012-10-13|823.05|2012-10-15|818.9|2012-10-12|RIL Q2 PAT seen down 12.1% at Rs 5,013 cr: Angel Broking
4.149999999999977|2012-10-14|823.05|2012-10-15|818.9|2012-10-12|Check Out: Stocks that you can trade on Monday
4.149999999999977|2012-10-14|823.05|2012-10-15|818.9|2012-10-12|RIL cuts capital investment in KG-D6 by over $3bn
4.149999999999977|2012-10-14|823.05|2012-10-15|818.9|2012-10-12|Govt approves bulk of delay-hit 52 oil & gas blocks
-6.449999999999932|2012-10-15|812.45|2012-10-16|818.9|2012-10-12|RIL Q2 net drops 6% YoY on poor gas output, lower margins 
-6.449999999999932|2012-10-15|812.45|2012-10-16|818.9|2012-10-12|Buy Reliance Industries, says Sukhani
-6.449999999999932|2012-10-15|812.45|2012-10-16|818.9|2012-10-12|Reliance results as expected, no surprises: Experts
-6.449999999999932|2012-10-15|812.45|2012-10-16|818.9|2012-10-12| Negative on series; Bet on Balrampur, DB Realty: Tulsian
-6.449999999999932|2012-10-15|812.45|2012-10-16|818.9|2012-10-12|RIL: Performance in line with expectations: Tulsian
-6.449999999999932|2012-10-15|812.45|2012-10-16|818.9|2012-10-12|Accumulate Reliance Industries at current levels: Kulkarni
-6.449999999999932|2012-10-15|812.45|2012-10-16|818.9|2012-10-12|BG bets big on India
-6.449999999999932|2012-10-15|812.45|2012-10-16|818.9|2012-10-12|Exit RIL at Rs 850: Sukhani
-6.449999999999932|2012-10-15|812.45|2012-10-16|818.9|2012-10-12|Chart of the day: How Reliance GRM fares against Singapore GRM
-6.449999999999932|2012-10-15|812.45|2012-10-16|818.9|2012-10-12|RIL Q2: Analysts see 20% QoQ growth in PAT
-6.449999999999932|2012-10-15|812.45|2012-10-16|818.9|2012-10-12|Reliance Q2: Here's what the street is expecting
-6.449999999999932|2012-10-15|812.45|2012-10-16|818.9|2012-10-12|BP considering LNG imports to India through JV
-6.449999999999932|2012-10-15|812.45|2012-10-16|818.9|2012-10-12|Reliance Industries can move to Rs 880: Jai Bala
-6.449999999999932|2012-10-15|812.45|2012-10-16|818.9|2012-10-12|Buy Reliance Industries, says Sudarshan Sukhani
-6.449999999999932|2012-10-15|812.45|2012-10-16|818.9|2012-10-12|Reliance Industries gains ahead of Q2 results
-6.449999999999932|2012-10-15|812.45|2012-10-16|818.9|2012-10-12|RIL plans to raise refining capacity
-17.899999999999977|2012-10-16|805.15|2012-10-17|823.05|2012-10-15|Reliance Ind Q2 petchem sales up 4.7% to Rs 22058 cr
-17.899999999999977|2012-10-16|805.15|2012-10-17|823.05|2012-10-15|Reliance Industries advances post Q2 numbers
-17.899999999999977|2012-10-16|805.15|2012-10-17|823.05|2012-10-15|HSBC downgrades RIL to 'underweight'
-17.899999999999977|2012-10-16|805.15|2012-10-17|823.05|2012-10-15|Reliance: What are brokerages recommending post Q2
-17.899999999999977|2012-10-16|805.15|2012-10-17|823.05|2012-10-15|RIL to be rangebound; pick IndusInd Bank: Sanju Verma
-17.899999999999977|2012-10-16|805.15|2012-10-17|823.05|2012-10-15|Reliance Industries may cross Rs 880-900 levels: Joshi
-1.150000000000091|2012-10-17|811.3|2012-10-18|812.45|2012-10-16|DGH may look at new oil, gas sharing system for govt
-1.150000000000091|2012-10-17|811.3|2012-10-18|812.45|2012-10-16|Hold Reliance Industries; target of Rs 827: Emkay
-1.150000000000091|2012-10-17|811.3|2012-10-18|812.45|2012-10-16|Venezuela in talks with Reliance Indus to explore blocks
-1.150000000000091|2012-10-17|811.3|2012-10-18|812.45|2012-10-16|Reliance Ind objects to second round of CAG audit
-2.3500000000000227|2012-10-18|802.8|2012-10-19|805.15|2012-10-17|Why you should buy Dish TV, RIL, Tata Motors on dips
4.300000000000068|2012-10-19|815.6|2012-10-22|811.3|2012-10-18|RIL makes 1st purchase of Canadian heavy oil: Sources
4.300000000000068|2012-10-19|815.6|2012-10-22|811.3|2012-10-18|2G auction application: Rel Comm, Sistema, RIL abstain
4.300000000000068|2012-10-19|815.6|2012-10-22|811.3|2012-10-18|Muted auction response; revenue target is tough: Experts 
4.300000000000068|2012-10-19|815.6|2012-10-22|811.3|2012-10-18|2G, 3G support vital for LTE rollout: Bhargava
12.800000000000068|2012-10-20|815.6|2012-10-22|802.8|2012-10-19|Rangebound market: Get expert advice to trade next week
12.800000000000068|2012-10-21|815.6|2012-10-22|802.8|2012-10-19|ONGC looking to hire RIL's unutilised facilities
12.800000000000068|2012-10-21|815.6|2012-10-22|802.8|2012-10-19|RIL to get higher gas price for KG-D6 gas
7.150000000000091|2012-10-22|809.95|2012-10-23|802.8|2012-10-19|Pavers England plans big to widen pan-Indian footprint 
7.150000000000091|2012-10-22|809.95|2012-10-23|802.8|2012-10-19|Bull's eye: Buy TCS, CESC, sell Kingfisher, Hindalco
7.150000000000091|2012-10-22|809.95|2012-10-23|802.8|2012-10-19|Sell Dena Bank, ITC; Sell RIL, JP Associates: Mittal
-5.2000000000000455|2012-10-23|810.4|2012-10-25|815.6|2012-10-22|Accumulate Reliance Industries; target Rs 875: KRChoksey
-11.0|2012-10-25|798.95|2012-10-26|809.95|2012-10-23|Mukesh Ambani richest Indian with wealth of $21bn: Forbes
-11.0|2012-10-25|798.95|2012-10-26|809.95|2012-10-23|RIL jumps post exemption from CAG's performance audit
-11.0|2012-10-25|798.95|2012-10-26|809.95|2012-10-23|ICICI Bank can touch Rs 1100, says Jitendra Panda
4.2999999999999545|2012-10-29|803.25|2012-10-30|798.95|2012-10-26|Reliance Industries gains; new oil minister appointed
4.2999999999999545|2012-10-29|803.25|2012-10-30|798.95|2012-10-26|ONGC well in K-G block leaking gas
-5.7000000000000455|2012-10-30|805.5|2012-10-31|811.2|2012-10-29|Hold RIL, BHEL: Sukhani
3.8500000000000227|2012-10-31|807.1|2012-11-01|803.25|2012-10-30|RIL's KG-D6: Oil Ministry postpones CAG meeting
3.8500000000000227|2012-10-31|807.1|2012-11-01|803.25|2012-10-30|Bull's eye: Buy IVRCL, RIL, Ceat, Havells India
3.8500000000000227|2012-10-31|807.1|2012-11-01|803.25|2012-10-30|Buy RIL, JSW Energy, DCW: Tater
2.4500000000000455|2012-11-01|807.95|2012-11-02|805.5|2012-10-31|Buy Lovable Lingerie, NIIT Tech, Shree Ganesh Jewel: Kapur
-0.9500000000000455|2012-11-02|806.15|2012-11-05|807.1|2012-11-01|CAG raps oil ministry over KG-D6 audit 
-1.8000000000000682|2012-11-03|806.15|2012-11-05|807.95|2012-11-02|Destimoney Securities suggests value buying, picks stocks
-2.5|2012-11-05|805.45|2012-11-06|807.95|2012-11-02|KG-D6: CAG pulls up oil min for agreeing to RIL's clauses
-2.5|2012-11-05|805.45|2012-11-06|807.95|2012-11-02|Audit a contractual obligation; RIL will abide by it: Moily
-2.5|2012-11-05|805.45|2012-11-06|807.95|2012-11-02|Reliance Industries has support around Rs 799: Harchekar
-8.850000000000023|2012-11-07|796.6|2012-11-08|805.45|2012-11-06|RIL's KG-D6: Govt plans roaster for gas supply to power cos
-8.850000000000023|2012-11-07|796.6|2012-11-08|805.45|2012-11-06|No Objection to CAG Audit: Reliance Industries
-13.200000000000045|2012-11-08|787.65|2012-11-09|800.85|2012-11-07|RIL selects Foster Wheeler as contractor for Jamnagar proj
-13.200000000000045|2012-11-08|787.65|2012-11-09|800.85|2012-11-07|RIL awaits commerciality declaration for 2 KG-D6 gas find
-13.200000000000045|2012-11-08|787.65|2012-11-09|800.85|2012-11-07|RIL selects Foster Wheeler as contractor for Jamnagar proj
-9.950000000000045|2012-11-09|786.65|2012-11-12|796.6|2012-11-08|Why is Tulsian entering realty on correction of 3-5 %
-9.950000000000045|2012-11-09|786.65|2012-11-12|796.6|2012-11-08|Reliance selects Foster Wheeler for its Paraxylene project in Jamnagar
-9.950000000000045|2012-11-09|786.65|2012-11-12|796.6|2012-11-08|Telecom firms allowed to raise ECBs to pay for 2G spectrum
1.9500000000000455|2012-11-12|789.6|2012-11-13|787.65|2012-11-09|Uncertainty impacting foreign investments: Harish Salve
-14.450000000000045|2012-11-15|775.15|2012-11-16|789.6|2012-11-13|Buy Reliance Ind Nov Fut above Rs 800, target Rs 830: IIFL
-14.450000000000045|2012-11-15|775.15|2012-11-16|789.6|2012-11-13|RIL seeks market based gas price from Rangarajan panel
-14.450000000000045|2012-11-15|775.15|2012-11-16|789.6|2012-11-13|RIL gets nod to drill a well in D-19 field
-10.300000000000068|2012-11-16|774.3|2012-11-19|784.6|2012-11-15|RIL gets nod to drill new well in D6; stock firms
-0.8500000000000227|2012-11-17|774.3|2012-11-19|775.15|2012-11-16|Q2 earnings: 9 stocks that beat estimates; 10 that didn't
-0.8500000000000227|2012-11-17|774.3|2012-11-19|775.15|2012-11-16|Sharmila picks ICICI, BHEL, Godrej Industries
-3.099999999999909|2012-11-20|771.2|2012-11-21|774.3|2012-11-19|OilMin withdraws note opposing KG-D6 gas price hike by RIL
-3.099999999999909|2012-11-20|771.2|2012-11-21|774.3|2012-11-19|6 stocks that should do well today
-3.099999999999909|2012-11-20|771.2|2012-11-21|774.3|2012-11-19|Reliance softens stance over proposed CAG audit: Sources 
0.5|2012-11-21|765.85|2012-11-22|765.35|2012-11-20|Kotak ups Reliance Ind to 'reduce' from 'sell', but bearish
2.5499999999999545|2012-11-22|773.75|2012-11-23|771.2|2012-11-21|Reliance Industries has target of Rs 860: TS Harihar
2.5499999999999545|2012-11-22|773.75|2012-11-23|771.2|2012-11-21|Not seeking revision in gas price before April 2014: RIL
7.7999999999999545|2012-11-23|773.65|2012-11-26|765.85|2012-11-22|Expert views: Trading tips on 10 largecap stocks
7.7999999999999545|2012-11-23|773.65|2012-11-26|765.85|2012-11-22|Reliance Industries may go to Rs 795-800: Thukral
-0.10000000000002274|2012-11-25|773.65|2012-11-26|773.75|2012-11-23|RIL agrees to CAG scrutiny expenses in KG gas block 
13.049999999999955|2012-11-26|786.8|2012-11-27|773.75|2012-11-23|RIL denies allegation of hoarding gas
13.049999999999955|2012-11-26|786.8|2012-11-27|773.75|2012-11-23|Buy Reliance Industries; target of Rs 824: IIFL
24.649999999999977|2012-11-27|798.3|2012-11-29|773.65|2012-11-26|Reliance Industries, TCS look good: Harchekar
6.900000000000091|2012-11-29|793.7|2012-11-30|786.8|2012-11-27|Reliance Industries can touch Rs 821, says Vayalar
31.0|2012-12-03|824.7|2012-12-04|793.7|2012-11-30|India to become a net importer of natural gas in two years
28.600000000000023|2012-12-04|832.6|2012-12-05|804.0|2012-12-03|Buy RIL around Rs 800; may rally to Rs 880-885: Kulkarni
28.600000000000023|2012-12-04|832.6|2012-12-05|804.0|2012-12-03|No reason for fertilisers' rally; negative on IT: Tulsian
28.600000000000023|2012-12-04|832.6|2012-12-05|804.0|2012-12-03|Reliance Inds has resistance around Rs 840-850: Sukhani
19.199999999999932|2012-12-05|843.9|2012-12-06|824.7|2012-12-04|RIL divests Yemen-9 block to Medco, Indonesia
19.199999999999932|2012-12-05|843.9|2012-12-06|824.7|2012-12-04|RIL completes sale of 25% stake in Yemen oil block for $90m
19.199999999999932|2012-12-05|843.9|2012-12-06|824.7|2012-12-04|RIL can see 10% upside in six month: Devang Mehta
19.199999999999932|2012-12-05|843.9|2012-12-06|824.7|2012-12-04|HC tells Sebi to make RIL party to appeal against CIC
19.199999999999932|2012-12-05|843.9|2012-12-06|824.7|2012-12-04|LNG imports to surpass domestic production in 2 yrs
19.199999999999932|2012-12-05|843.9|2012-12-06|824.7|2012-12-04|RIL gets $2.1bn credit support from US EXIM Bank
2.0|2012-12-06|834.6|2012-12-07|832.6|2012-12-05|RIL to shut crude distillation unit at Jamnagar in Jan
2.0|2012-12-06|834.6|2012-12-07|832.6|2012-12-05|BP begins first drilling in 16 mths after RIL investment
2.0|2012-12-06|834.6|2012-12-07|832.6|2012-12-05|Ex-Im to extend USD 2.1 billion credit to RIL
2.0|2012-12-06|834.6|2012-12-07|832.6|2012-12-05|Positive on Lance, Suzlon and IVRCL: Tulsian
2.0|2012-12-06|834.6|2012-12-07|832.6|2012-12-05|Ex-Im to extend $2.1bn credit to Reliance Ind; stk down
2.0|2012-12-06|834.6|2012-12-07|832.6|2012-12-05|Govt bars oil PSUs from setting up self-funded petrol pumps
-15.600000000000023|2012-12-07|828.3|2012-12-10|843.9|2012-12-06|Reliance-BP start drilling at D6 post 16 months of approval
-15.600000000000023|2012-12-07|828.3|2012-12-10|843.9|2012-12-06|Buy Reliance Industries, says Sukhani
-6.300000000000068|2012-12-08|828.3|2012-12-10|834.6|2012-12-07|Know Your Investment: 11 short-term picks for good returns
-6.300000000000068|2012-12-09|828.3|2012-12-10|834.6|2012-12-07|RIL opposes uniform marketing margin for natural gas
-14.550000000000068|2012-12-10|820.05|2012-12-11|834.6|2012-12-07|DGH scraps RIL's proposal of single test in 3 discoveries
-14.550000000000068|2012-12-10|820.05|2012-12-11|834.6|2012-12-07|Barmer refinery unviable without all crude from Cairn: HPCL
4.300000000000068|2012-12-11|832.6|2012-12-12|828.3|2012-12-10|'CAG will confine to financial audit of KG-D6 block'
14.200000000000045|2012-12-12|834.25|2012-12-13|820.05|2012-12-11|Parliament panel pulls up Oil Min for inaction against RIL
14.200000000000045|2012-12-12|834.25|2012-12-13|820.05|2012-12-11|See upside in Reliance Industries: Anil Manghnani
6.649999999999977|2012-12-13|839.25|2012-12-14|832.6|2012-12-12|Stay invested in PFC: Sukhani
6.649999999999977|2012-12-13|839.25|2012-12-14|832.6|2012-12-12|RIL shuts seventh well on KG-D6 gas block
-0.10000000000002274|2012-12-14|834.15|2012-12-17|834.25|2012-12-13|RIL, BP shut seventh well at KG-D6 gas block: Source
5.350000000000023|2012-12-18|839.5|2012-12-19|834.15|2012-12-17|Top super six stocks ideas for December 18
5.350000000000023|2012-12-18|839.5|2012-12-19|834.15|2012-12-17|RIL has agreed to CAG audit: Oil Ministry
6.4500000000000455|2012-12-19|837.85|2012-12-20|831.4|2012-12-18|OilMin to seek legal opinion on RIL, Cairn pleas
6.4500000000000455|2012-12-19|837.85|2012-12-20|831.4|2012-12-18|RIL plans to invest USD 10 bn on its 4G network: Vendor
-14.25|2012-12-20|825.25|2012-12-21|839.5|2012-12-19|CIC should have heard RIL in RTI insider trading case:HC
-17.149999999999977|2012-12-21|820.7|2012-12-24|837.85|2012-12-20|Buy RIL Jan Fut above Rs 853, target Rs 883: IIFL
-17.149999999999977|2012-12-21|820.7|2012-12-24|837.85|2012-12-20|RIL to restart crude unit in 1-2 days after fire
3.0|2012-12-24|828.25|2012-12-26|825.25|2012-12-21|Here's how one should play RIL, DLF, Balrampur Chini 
3.0|2012-12-24|828.25|2012-12-26|825.25|2012-12-21|Reliance Industries can move to Rs 1000, says Baliga
-3.0|2012-12-26|817.7|2012-12-27|820.7|2012-12-24|DLF can move to Rs 244: Anil Manghnani
12.0|2012-12-27|840.25|2012-12-28|828.25|2012-12-26|RIL says no agreement done to buy Hotel Leela's biz park
21.84999999999991|2012-12-28|839.55|2012-12-31|817.7|2012-12-27|Buying opportunities seen in Infosys, Wipro: Sukhani
21.84999999999991|2012-12-28|839.55|2012-12-31|817.7|2012-12-27|Positive on mkt, target of 6100-6150 on Nifty: Tulsian
21.84999999999991|2012-12-28|839.55|2012-12-31|817.7|2012-12-27|Gas producers to be allowed to charge mkt rates: 12th Plan
21.84999999999991|2012-12-28|839.55|2012-12-31|817.7|2012-12-27|Buy Reliance, ONGC: Sukhani
21.84999999999991|2012-12-28|839.55|2012-12-31|817.7|2012-12-27|Prefer Reliance Industries, says Anil Manghnani
21.84999999999991|2012-12-28|839.55|2012-12-31|817.7|2012-12-27|Year 2013: 11 stocks that can give you handsome returns 
-0.7000000000000455|2012-12-29|839.55|2012-12-31|840.25|2012-12-28|F&O market: Strategy for RIL, Pantaloon
-0.7000000000000455|2012-12-29|839.55|2012-12-31|840.25|2012-12-28|Buy Pantaloon Retail futures for target of Rs 265: Thukral
-0.7000000000000455|2012-12-30|839.55|2012-12-31|840.25|2012-12-28|RIL buys back shares worth Rs. 3,800 crore
0.4500000000000455|2012-12-31|840.7|2013-01-01|840.25|2012-12-28|Bull's Eye: Short HDIL, L&T, RIL; buy Escorts
