Difference|date|nextClose|nextDay|prevClose|prevDay|text
-4.449999999999932|2016-08-22|1010.45|2016-08-23|1014.9|2016-08-19|RIL asks staff to stop using mobile service of other operators
8.649999999999977|2016-08-23|1020.5|2016-08-24|1011.85|2016-08-22|RJio extends free 4G service to Samsung Z2 handset
2.25|2016-08-24|1012.7|2016-08-25|1010.45|2016-08-23|Buy HDFC Bank, Reliance Industries: Mitesh Thacker
38.5|2016-08-29|1066.4|2016-08-30|1027.9|2016-08-26|Buy Heritage Foods, M&M Fin, Reliance Industries: Ashwani Gujral
38.5|2016-08-29|1066.4|2016-08-30|1027.9|2016-08-26|Buy M&M Financial, Reliance Industries; sell HCL Tech: Wagle
38.5|2016-08-29|1066.4|2016-08-30|1027.9|2016-08-26|Buy RIL, see deeper correction in realty stocks: Sukhani
38.5|2016-08-29|1066.4|2016-08-30|1027.9|2016-08-26|RIL gets green panel nod for jetty expansion in Gujarat
38.5|2016-08-29|1066.4|2016-08-30|1027.9|2016-08-26|Buy Jain Irrigation, Reliance Industries, Bharat Forge: MOST
38.5|2016-08-29|1066.4|2016-08-30|1027.9|2016-08-26|Buy RIL, Hero MotoCorp; sell Bharti Airtel: Mitesh Thacker
2.5499999999999545|2016-08-30|1060.0|2016-08-31|1057.45|2016-08-29|Bull's Eye: Buy ADF Foods, RIL, Exide, Delta Corp, Cummins
-37.200000000000045|2016-08-31|1029.2|2016-09-01|1066.4|2016-08-30|Buy Reliance Industries 1050 Call: Amit Gupta
-37.200000000000045|2016-08-31|1029.2|2016-09-01|1066.4|2016-08-30|Sell DLF, Karnataka Bank, BoI: Rahul Mohindar
-37.200000000000045|2016-08-31|1029.2|2016-09-01|1066.4|2016-08-30|Shah panel submits report on compensation from RIL to ONGC
-37.200000000000045|2016-08-31|1029.2|2016-09-01|1066.4|2016-08-30|Tulsian's take on construction cos, Zee, RBL Bank & other stocks
-46.64999999999998|2016-09-01|1013.35|2016-09-02|1060.0|2016-08-31|Jio plans are awesome; happy days ahead for customers: Pros
-46.64999999999998|2016-09-01|1013.35|2016-09-02|1060.0|2016-08-31|RIL not to withdraw arbitration against govt: Ambani
-46.64999999999998|2016-09-01|1013.35|2016-09-02|1060.0|2016-08-31|Find out why Diwan thinks RIL's oil, gas biz are shock-proof
-46.64999999999998|2016-09-01|1013.35|2016-09-02|1060.0|2016-08-31|#JioMereLal: Jio's launch buzz takes social media by storm
-46.64999999999998|2016-09-01|1013.35|2016-09-02|1060.0|2016-08-31|Mukesh Ambani says RJio data tariffs to be 'lowest' in world
-46.64999999999998|2016-09-01|1013.35|2016-09-02|1060.0|2016-08-31|RIP voice charges, disruptor Jio tells world at Reliance AGM
-46.64999999999998|2016-09-01|1013.35|2016-09-02|1060.0|2016-08-31|Aim to deliver double digit volume growth after monsoon: Idea
-46.64999999999998|2016-09-01|1013.35|2016-09-02|1060.0|2016-08-31|Reliance Jio parks Rs 5,000 cr fund for startups
-46.64999999999998|2016-09-01|1013.35|2016-09-02|1060.0|2016-08-31|Jio to set in motion data, voice war among telcos: Experts
-46.64999999999998|2016-09-01|1013.35|2016-09-02|1060.0|2016-08-31|Reliance Jio announces free voice calls, cheaper data tariffs
-46.64999999999998|2016-09-01|1013.35|2016-09-02|1060.0|2016-08-31|Ambani may give update on 4G services at RIL AGM today
-46.64999999999998|2016-09-01|1013.35|2016-09-02|1060.0|2016-08-31|Justice Shah: Why ONGC is not entitled to RIL compensation
-46.64999999999998|2016-09-01|1013.35|2016-09-02|1060.0|2016-08-31|ONGC did not suspect gas migration to RIL block till '13: Ex-CMD
-46.64999999999998|2016-09-01|1013.35|2016-09-02|1060.0|2016-08-31|Calling Jio: Key takeaways from Reliance Inds' 42nd AGM
-46.64999999999998|2016-09-01|1013.35|2016-09-02|1060.0|2016-08-31|RIL chairman Mukesh Ambani says to slash telecom prices
-46.64999999999998|2016-09-01|1013.35|2016-09-02|1060.0|2016-08-31|RIL should go up from current level: Deven Choksey
-46.64999999999998|2016-09-01|1013.35|2016-09-02|1060.0|2016-08-31|RIL AGM UPDATES: Ambani's datagiri on offer; Jio to offer free calls, cheap data
-46.64999999999998|2016-09-01|1013.35|2016-09-02|1060.0|2016-08-31|RIL chairman Mukesh Ambani says aims for 100 mn customers
-9.300000000000068|2016-09-02|1019.9|2016-09-06|1029.2|2016-09-01|HDFC Bank briefly pips RIL to become second most valued firm
-9.300000000000068|2016-09-02|1019.9|2016-09-06|1029.2|2016-09-01|Buy Reliance Industries; target of Rs 1200: Religare
-9.300000000000068|2016-09-02|1019.9|2016-09-06|1029.2|2016-09-01|Buy Tata Chemicals, NCC; sell Infosys: Ashwani Gujral
-9.300000000000068|2016-09-02|1019.9|2016-09-06|1029.2|2016-09-01|Telecom War: The Jio shake-up!
-9.300000000000068|2016-09-02|1019.9|2016-09-06|1029.2|2016-09-01|Reliance Industries: Outcome of AGM
-9.300000000000068|2016-09-02|1019.9|2016-09-06|1029.2|2016-09-01|Indian telecom carriers face price target cut on Jio threat
-9.300000000000068|2016-09-02|1019.9|2016-09-06|1029.2|2016-09-01|Investment tips: Should you buy Bharti, Idea or Reliance?
-9.300000000000068|2016-09-02|1019.9|2016-09-06|1029.2|2016-09-01|RJio needs 75-80 mn users in 2-3 years to break even: Analysts
6.5499999999999545|2016-09-03|1019.9|2016-09-06|1013.35|2016-09-02|Jio announces commencement of services from Sept 5 across the country
4.2999999999999545|2016-09-06|1017.65|2016-09-07|1013.35|2016-09-02|Big Deal: Reliance Jio is here
26.899999999999977|2016-09-08|1044.55|2016-09-09|1017.65|2016-09-07|Reliance Industries rated among top 10 global companies: Survey
26.899999999999977|2016-09-08|1044.55|2016-09-09|1017.65|2016-09-07|Key takeaways from Reliance Chairman Mukesh Ambani's interview
26.899999999999977|2016-09-08|1044.55|2016-09-09|1017.65|2016-09-07|Mukesh Ambani says Jio's rivals making excuses over interconnect
26.899999999999977|2016-09-08|1044.55|2016-09-09|1017.65|2016-09-07|Telecom operators' body writes to PMO over Jio
26.899999999999977|2016-09-08|1044.55|2016-09-09|1017.65|2016-09-07|Buy Reliance Industries, Bajaj Auto, JM Financial: Gujral
26.899999999999977|2016-09-08|1044.55|2016-09-09|1017.65|2016-09-07|Gas price for ONGC may be slashed by 20%: CMD Sarraf
13.099999999999909|2016-09-09|1046.5|2016-09-12|1033.4|2016-09-08|ONGC is seeking compensation over the KG basin dispute: CMD
13.099999999999909|2016-09-09|1046.5|2016-09-12|1033.4|2016-09-08|Buy Indiabulls Real Estate, RIL; sell M&M Financial: Gujral
1.9500000000000455|2016-09-11|1046.5|2016-09-12|1044.55|2016-09-09|Top four cos lose Rs 40,780 cr in mcap; TCS hit hard
30.799999999999955|2016-09-15|1075.55|2016-09-16|1044.75|2016-09-14|Buy RIL, Automotive Axle; sell IndusInd Bank: Gujral
6.850000000000136|2016-09-17|1082.4|2016-09-19|1075.55|2016-09-16|Next 20 yrs to see more progress than the previous 100: Ambani
6.850000000000136|2016-09-17|1082.4|2016-09-19|1075.55|2016-09-16|Look at Reliance Industries: Porinju Veliyath
6.850000000000136|2016-09-17|1082.4|2016-09-19|1075.55|2016-09-16|Buy Reliance Capital, target Rs 800: Ashwani Gujral
-1.349999999999909|2016-09-19|1074.2|2016-09-20|1075.55|2016-09-16|Buy RIL on dips, ICICI Bank can move to Rs 295: Ashwani Gujral
-10.150000000000091|2016-09-20|1072.25|2016-09-21|1082.4|2016-09-19|Buy Aurobindo Pharma, RIL, Arvind; sell Pidilite: Taparia
14.75|2016-09-21|1088.95|2016-09-22|1074.2|2016-09-20|Buy Karnataka Bank, Union Bank, RIL: Rahul Mohindar
30.549999999999955|2016-09-22|1102.8|2016-09-23|1072.25|2016-09-21|Mukesh Ambani tops Forbes' 100 Richest Indians list
30.549999999999955|2016-09-22|1102.8|2016-09-23|1072.25|2016-09-21|Reliance Industries may test Rs 1300, says Daljeet Singh Kohli
18.25|2016-09-23|1107.2|2016-09-26|1088.95|2016-09-22|Checkout: Reason why Tulsian likes Bharat Forge, Aurobindo
18.25|2016-09-23|1107.2|2016-09-26|1088.95|2016-09-22|Airtel offers unlimited data for 3 months at Rs 1,495
18.25|2016-09-23|1107.2|2016-09-26|1088.95|2016-09-22|Here are Deven Choksey's top trading ideas
7.7000000000000455|2016-09-26|1110.5|2016-09-27|1102.8|2016-09-23|Top six cos add Rs 33,985 cr in m-cap, RIL scales up the most
7.7000000000000455|2016-09-26|1110.5|2016-09-27|1102.8|2016-09-23|Here are a few investment ideas from Prakash Diwan
7.7000000000000455|2016-09-26|1110.5|2016-09-27|1102.8|2016-09-23|Bullish on Reliance Industries, buy on dips: Prakash Gaba
7.7000000000000455|2016-09-26|1110.5|2016-09-27|1102.8|2016-09-23|See upside in Reliance Industries: Prakash Diwan
7.7000000000000455|2016-09-26|1110.5|2016-09-27|1102.8|2016-09-23|Buy Grasim, Reliance Industries, Jain Irrigation: Rahul Shah
7.7000000000000455|2016-09-26|1110.5|2016-09-27|1102.8|2016-09-23|Sell Tata Motors, ITC; buy BPCL:Ashwani Gujral
7.7000000000000455|2016-09-26|1110.5|2016-09-27|1102.8|2016-09-23|Look at Reliance Industries on correction: Sanjiv Bhasin
-16.549999999999955|2016-09-27|1090.65|2016-09-28|1107.2|2016-09-26|Buy Reliance Industries, Siemens: Rajat Bose
-38.049999999999955|2016-09-28|1072.45|2016-09-29|1110.5|2016-09-27|Reliance Industries may slip to Rs 1070-1080: Ashwani Gujral
-38.049999999999955|2016-09-28|1072.45|2016-09-29|1110.5|2016-09-27|Buy Delta Corp, IDFC, Havells: Ashwani Gujral
12.649999999999864|2016-10-03|1096.35|2016-10-04|1083.7|2016-09-30|Buy RIL, HDFC Bank, LIC Housing Finance: Sudarshan Sukhani
12.649999999999864|2016-10-03|1096.35|2016-10-04|1083.7|2016-09-30|Exit Idea Cellular, says Prakash Gaba
-1.2999999999999545|2016-10-04|1089.4|2016-10-05|1090.7|2016-10-03|Hindustan Zinc enters Rs 1 lakh cr m-cap league
-1.2999999999999545|2016-10-04|1089.4|2016-10-05|1090.7|2016-10-03|Buy, sell or hold: Best stocks from auto, steel, telecom & oil
-1.2999999999999545|2016-10-04|1089.4|2016-10-05|1090.7|2016-10-03|Buy Petronet LNG, United Breweries, Cipla: Ashwani Gujral
19.59999999999991|2016-10-06|1109.0|2016-10-07|1089.4|2016-10-05|Buy IGL, Aurobindo Pharma; sell Mindtree: Ashwani Gujral
19.59999999999991|2016-10-06|1109.0|2016-10-07|1089.4|2016-10-05|Bullish on RIL, IndusInd Bank may climb to Rs 1257: Rajat Bose
19.59999999999991|2016-10-06|1109.0|2016-10-07|1089.4|2016-10-05|UPI and payment banks aren't comparable: SBI's Rajnish Kumar
-14.450000000000045|2016-10-07|1096.35|2016-10-10|1110.8|2016-10-06|Edelweiss prefers IGL on strong volumes; likes OMCs but on dips
-14.450000000000045|2016-10-07|1096.35|2016-10-10|1110.8|2016-10-06|Buy Reliance Industries 1120 Call: VK Sharma
-14.450000000000045|2016-10-07|1096.35|2016-10-10|1110.8|2016-10-06|Reliance JIO announces acquisition of 269.2 MHz spectrum in 800MHz, 1800MHz and 2300 MHz bands
-12.650000000000091|2016-10-09|1096.35|2016-10-10|1109.0|2016-10-07|RJio sets 'world record', enrols 16mn users in 1st month
-39.19999999999982|2016-10-12|1057.15|2016-10-13|1096.35|2016-10-10|RIL's energy biz cash flow to offset outgo on spectrum: S&P
-18.699999999999818|2016-10-13|1077.65|2016-10-14|1096.35|2016-10-10|Sell Coal India, Reliance Industries: Sudarshan Sukhani
-18.699999999999818|2016-10-13|1077.65|2016-10-14|1096.35|2016-10-10|Accumulate Engineers India, see 30% upside: Prakash Diwan
-18.699999999999818|2016-10-13|1077.65|2016-10-14|1096.35|2016-10-10|Reliance Industries: Q2 results on October 20, 2016
3.5|2016-10-14|1060.65|2016-10-17|1057.15|2016-10-13|Sell Zee Entertainment, Bata India; buy GNFC: Ashwani Gujral
3.449999999999818|2016-10-17|1081.1|2016-10-18|1077.65|2016-10-14|Buy Reliance Industries, Jain Irrigation, UPL: Rahul Shah
3.449999999999818|2016-10-17|1081.1|2016-10-18|1077.65|2016-10-14|Sell Reliance Industries, Hero MotoCorp: Mitesh Thacker
26.699999999999818|2016-10-18|1087.35|2016-10-19|1060.65|2016-10-17|Sell Maruti, Amara Raja, RIL; buy Tata Steel: Ashwani Gujral
6.4500000000000455|2016-10-19|1087.55|2016-10-20|1081.1|2016-10-18|Reliance Industries Q2 PAT seen down 3% to Rs 7549 cr: Religare
6.4500000000000455|2016-10-19|1087.55|2016-10-20|1081.1|2016-10-18|RIL Q2 profit seen at Rs 7266 cr, petchem margin may be strong
-23.149999999999864|2016-10-20|1064.2|2016-10-21|1087.35|2016-10-19|Polyester demand improving, consumer biz gaining traction: RIL
-23.149999999999864|2016-10-20|1064.2|2016-10-21|1087.35|2016-10-19|RIL blockbuster numbers to continue into H2; stock to gain: Pros
-23.149999999999864|2016-10-20|1064.2|2016-10-21|1087.35|2016-10-19|IDBI Cap's expections on Q2 FY17 numbers of RIL
-23.149999999999864|2016-10-20|1064.2|2016-10-21|1087.35|2016-10-19|Reliance Q2 profit rises 18%; GRM at $10.1/bbl, petchem shines
-23.149999999999864|2016-10-20|1064.2|2016-10-21|1087.35|2016-10-19|Jio free service offer available for subscription till Dec 3
-24.25|2016-10-21|1063.3|2016-10-24|1087.55|2016-10-20|Jio to touch 100 mn subscribers in next 3 years: Edelweiss
-24.25|2016-10-21|1063.3|2016-10-24|1087.55|2016-10-20|Here are some stock ideas from Deven Choksey
-24.25|2016-10-21|1063.3|2016-10-24|1087.55|2016-10-20|Buy Reliance Industries 1090 Call, says VK Sharma
-24.25|2016-10-21|1063.3|2016-10-24|1087.55|2016-10-20|Buy, sell, hold: 11 shinning gems for your portfolio
-24.25|2016-10-21|1063.3|2016-10-24|1087.55|2016-10-20|Buy IGL, ICICI Bank; sell Tata Motors, Reliance Ind: Gujral
-24.25|2016-10-21|1063.3|2016-10-24|1087.55|2016-10-20|Buy Bharat Financial, PNB, SRF; sell HUL, Century Tex: Gujral
-24.25|2016-10-21|1063.3|2016-10-24|1087.55|2016-10-20|Reliance Retail's pre-tax profit jumps 31% to Rs 264 cr
-24.25|2016-10-21|1063.3|2016-10-24|1087.55|2016-10-20|Buy Reliance Industries; target of Rs 1200: Religare
-0.900000000000091|2016-10-23|1063.3|2016-10-24|1064.2|2016-10-21|Reliance forays into LPG retailing
-9.25|2016-10-25|1054.05|2016-10-26|1063.3|2016-10-24|RIL raises $573 mn loan for 6 large ethane carriers
-12.149999999999864|2016-10-26|1048.7|2016-10-27|1060.85|2016-10-25|Buy Reliance Industries; target of Rs 1300: Axis Direct
-12.149999999999864|2016-10-26|1048.7|2016-10-27|1060.85|2016-10-25|Buy Reliance Industries; target of Rs 1285: KR Choksey
2.5|2016-10-28|1051.2|2016-10-30|1048.7|2016-10-27|India's $20 billion refinery expansion to cut fuel oil output
-0.20000000000004547|2016-10-31|1051.0|2016-11-01|1051.2|2016-10-30|Top 6 cos lose Rs 26,191 cr in m-cap, Infosys hit hard
-27.049999999999955|2016-11-02|1023.95|2016-11-03|1051.0|2016-11-01|Canara Bank can slide to Rs 288, RIL Rs 1010: Prakash Gaba
-27.049999999999955|2016-11-02|1023.95|2016-11-03|1051.0|2016-11-01|Accumulate Reliance; target of Rs 1102: Prabhudas Lilladher
-18.200000000000045|2016-11-03|1005.55|2016-11-04|1023.75|2016-11-02|Fitch affirms RIL's rating with stable outlook on robust biz
-18.200000000000045|2016-11-03|1005.55|2016-11-04|1023.75|2016-11-02|Buy Reliance Industries, Coal India; sell Infosys: Gujral
-22.800000000000068|2016-11-04|1001.15|2016-11-07|1023.95|2016-11-03|Short Reliance Industries, State Bank of India: Rajat Bose
-22.800000000000068|2016-11-04|1001.15|2016-11-07|1023.95|2016-11-03|ONGC gas row: Govt imposes $1.55 bn penalty on RIL, BP, Niko
-22.800000000000068|2016-11-04|1001.15|2016-11-07|1023.95|2016-11-03|Reliance to contest government's $1.55 bn penalty
-4.399999999999977|2016-11-06|1001.15|2016-11-07|1005.55|2016-11-04|RIL partners consider joining arbitration in USD1.55 bn gas row
-25.0|2016-11-11|985.4|2016-11-15|1010.4|2016-11-10|Engineers India can climb to Rs 285, RIL Rs 1030: Prakash Gaba
-16.350000000000023|2016-11-13|985.4|2016-11-15|1001.75|2016-11-11|Top six companies lose Rs 91,800 cr in market valuation
-15.200000000000045|2016-11-15|986.55|2016-11-16|1001.75|2016-11-11|RIL's partner Niko puts KG-D6 stake for sale
0.9500000000000455|2016-11-17|987.5|2016-11-18|986.55|2016-11-16|Buy BHEL, sell Reliance Industries: Rajat Bose
13.75|2016-11-18|991.5|2016-11-21|977.75|2016-11-17|RIL, GE form global partnership for $25 bn industrial IoT biz
-14.100000000000023|2016-11-23|987.35|2016-11-24|1001.45|2016-11-22|BHEL commissions 93 MW unit at RIL's Hazira power plant
-0.7000000000000455|2016-11-25|986.65|2016-11-28|987.35|2016-11-24|Hold Reliance Industries, says Prakash Gaba
-0.7000000000000455|2016-11-25|986.65|2016-11-28|987.35|2016-11-24|Remain invested in Reliance Industries: Avinash Gorakshakar
-7.050000000000068|2016-11-27|986.65|2016-11-28|993.7|2016-11-25|RIL seeks access to India's longest LPG pipeline by IOC
3.3999999999999773|2016-11-29|990.05|2016-11-30|986.65|2016-11-28|Buy UPL, Bajaj Finance, Reliance Industries: Sudarshan Sukhani
3.3999999999999773|2016-11-29|990.05|2016-11-30|986.65|2016-11-28|Parag Thakkar positive on telecom sector
4.7000000000000455|2016-12-01|994.75|2016-12-02|990.05|2016-11-30|Mukesh Ambani to address stakeholders via live broadcast today
4.7000000000000455|2016-12-01|994.75|2016-12-02|990.05|2016-11-30|Live Updates: All Jio users to get free services till March 2017
4.7000000000000455|2016-12-01|994.75|2016-12-02|990.05|2016-11-30|Jio's Happy New Year offer gives users free services till March
4.7000000000000455|2016-12-01|994.75|2016-12-02|990.05|2016-11-30|India Inc's foreign borrowings at $1.47 bn in October
4.7000000000000455|2016-12-01|994.75|2016-12-02|990.05|2016-11-30|Bharti, Idea fall 2-4% after Jio extends free offer till March
4.7000000000000455|2016-12-01|994.75|2016-12-02|990.05|2016-11-30|Buy Reliance Industries, CSEC, Dabur India: Ashwani Gujral
4.7000000000000455|2016-12-01|994.75|2016-12-02|990.05|2016-11-30|Jio Happy New Year Offer: Experts discuss impact on incumbents
-3.8999999999999773|2016-12-02|993.85|2016-12-05|997.75|2016-12-01|Buy Reliance Industries; target of Rs 1407: Edelweiss
-3.8999999999999773|2016-12-02|993.85|2016-12-05|997.75|2016-12-01|Buy, sell, hold: 7 key stocks that you should focus now
5.2999999999999545|2016-12-06|999.15|2016-12-07|993.85|2016-12-05|Buy Reliance Industries, Jindal Steel & Power: Mitesh Thacker
7.150000000000091|2016-12-09|1027.2|2016-12-12|1020.05|2016-12-08|Buy Reliance Industries, IndusInd Bank, OBC: Ashwani Gujral
7.150000000000091|2016-12-09|1027.2|2016-12-12|1020.05|2016-12-08|Buy Century Textiles, RIL, Apollo Tyres, HCL Info: Thacker
-1.75|2016-12-11|1027.2|2016-12-12|1028.95|2016-12-09|Nine of top 10 firms add Rs 56,112 cr in m-cap; ONGC, RIL shine
10.849999999999909|2016-12-12|1039.8|2016-12-13|1028.95|2016-12-09|Buy Reliance Industries on declines towards Rs 980-1000: Gujral
13.150000000000091|2016-12-14|1052.95|2016-12-15|1039.8|2016-12-13|Go long in Reliance Industries, short Nifty: Amit Gupta
13.150000000000091|2016-12-14|1052.95|2016-12-15|1039.8|2016-12-13|Buy Capital First, Reliance Industries; sell UPL: Ashwani Gujral
13.150000000000091|2016-12-14|1052.95|2016-12-15|1039.8|2016-12-13|Buy NIIT, Aarti Industries; sell Arvind: Ashwani Gujral
13.150000000000091|2016-12-14|1052.95|2016-12-15|1039.8|2016-12-13|Buy HCL Tech, Reliance Industries; sell OBC: Sandeep Wagle
13.150000000000091|2016-12-14|1052.95|2016-12-15|1039.8|2016-12-13|Here's why Tulsian is positive on sugar, non-index stocks
-2.349999999999909|2016-12-15|1057.15|2016-12-16|1059.5|2016-12-14|Buy Apollo Tyres, Reliance Industries, JSW Energy: Rajat Bose
-2.349999999999909|2016-12-15|1057.15|2016-12-16|1059.5|2016-12-14|Buy RIL, Petronet LNG; sell PNB, M&M Fin, Union Bank: Gujral
5.399999999999864|2016-12-18|1062.55|2016-12-19|1057.15|2016-12-16|Six of top 10 cos take Rs 38,221cr hit in mcap;CIL loses most
0.75|2016-12-19|1057.9|2016-12-20|1057.15|2016-12-16|Buy Reliance Industries, sell Pidilite, Marico: Sukhani
-5.9500000000000455|2016-12-22|1057.3|2016-12-23|1063.25|2016-12-21|Buy Reliance Industries; sell Voltas, Infosys: Ashwani Gujral
7.400000000000091|2016-12-26|1064.7|2016-12-27|1057.3|2016-12-23|Sell Yes Bank, JSW Steel, Ceat: Ashwani Gujral
7.400000000000091|2016-12-26|1064.7|2016-12-27|1057.3|2016-12-23|G S Singhvi named arbitrator for $1.5 bn ONGC-RIL dispute
2.25|2016-12-27|1049.7|2016-12-28|1047.45|2016-12-26|Buy Reliance Industries, Infosys, Engineers India: Sukhani
2.25|2016-12-27|1049.7|2016-12-28|1047.45|2016-12-26|Buy RIL, overweight on TCS, HCL Tech, Mindtree: Sanjiv Bhasin
0.75|2016-12-28|1065.45|2016-12-29|1064.7|2016-12-27|Buy Century Textiles, Maruti, RIL, CESC: Ashwani Gujral
0.75|2016-12-28|1065.45|2016-12-29|1064.7|2016-12-27|Here are a few stock ideas from SP Tulsian
0.75|2016-12-28|1065.45|2016-12-29|1064.7|2016-12-27|Buy Reliance Industries, TCS, Maruti Suzuki: Sudarshan Sukhani
0.75|2016-12-28|1065.45|2016-12-29|1064.7|2016-12-27|RIL commissions 1st phase of Paraxylene plant at Jamnagar
32.700000000000045|2016-12-29|1082.4|2016-12-30|1049.7|2016-12-28|Reliance Industries commissions new paraxylene plant at Jamnagar
32.700000000000045|2016-12-29|1082.4|2016-12-30|1049.7|2016-12-28|Retailers take on online biggies, eye consolidation in 2017
19.649999999999864|2016-12-30|1085.1|2017-01-02|1065.45|2016-12-29|Buy RIL, Coromandel Intl, GSFC; sell Sun Pharma: Ashwani Gujral
19.649999999999864|2016-12-30|1085.1|2017-01-02|1065.45|2016-12-29|Buy HDIL, Bharat Electronics, Infosys: Ashwani Gujral
19.649999999999864|2016-12-30|1085.1|2017-01-02|1065.45|2016-12-29|Buy India Cements, Marico, Reliance Industries: Ashwani Gujral
7.0|2017-01-02|1089.4|2017-01-03|1082.4|2016-12-30|Buy IGL, Tata Chemicals, India Cements, L&T Finance: Gujral
7.0|2017-01-02|1089.4|2017-01-03|1082.4|2016-12-30|Buy ACC, Ambuja Cements, UltraTech; avoid ITC: Sudarshan Sukhani
-17.949999999999818|2017-01-03|1067.15|2017-01-04|1085.1|2017-01-02|Invest in RIL, see significant gains in NMDC: Sudarshan Sukhani
7.7999999999999545|2017-01-05|1074.95|2017-01-06|1067.15|2017-01-04|Buy TCS, L&T Finance, IRB Infra; sell Vedanta: Sudarshan Sukhani
7.7999999999999545|2017-01-05|1074.95|2017-01-06|1067.15|2017-01-04|Buy RIL, Infosys, Motherson Sumi, Bharat Financial: Sukhani
7.7999999999999545|2017-01-05|1074.95|2017-01-06|1067.15|2017-01-04|Global cos offer ONGC deepsea drilling rigs for KG gas find
0.2999999999999545|2017-01-06|1077.7|2017-01-09|1077.4|2017-01-05|Buy RIL, Petronet; see higher levels in cement stocks: Sukhani
0.2999999999999545|2017-01-06|1077.7|2017-01-09|1077.4|2017-01-05|Like RIL, Hindustan Zinc; PNB can climb to Rs 125: Prakash Gaba
14.899999999999864|2017-01-09|1089.85|2017-01-10|1074.95|2017-01-06|Buy Reliance Industries, Marico, Adani Ports: Sudarshan Sukhani
8.349999999999909|2017-01-10|1086.05|2017-01-11|1077.7|2017-01-09|Tulsian's preferred picks in transmission, bank & tyre sectors
-6.5499999999999545|2017-01-11|1083.3|2017-01-12|1089.85|2017-01-10|Buy Titan, RIL, India Cements; short Ajanta Pharma: Sukhani
4.350000000000136|2017-01-12|1090.4|2017-01-13|1086.05|2017-01-11|Reliance Inds. Q3 PAT seen up 3.9% to Rs 8002 cr: Motilal Oswal
-7.0499999999999545|2017-01-13|1076.25|2017-01-16|1083.3|2017-01-12|Positive results from TCS, could drive rerating: Deven Choksey
-7.0499999999999545|2017-01-13|1076.25|2017-01-16|1083.3|2017-01-12|Buy RIL on dips; bullish on Future Lifestyle: Sanjiv Bhasin
-7.0499999999999545|2017-01-13|1076.25|2017-01-16|1083.3|2017-01-12|Tulsian's take on housing finance, Tata Grp cos & others
-49.15000000000009|2017-01-16|1041.25|2017-01-17|1090.4|2017-01-13|Jio subscribers at 72.4 mn at Dec end; PoI issues continue:RIL
-49.15000000000009|2017-01-16|1041.25|2017-01-17|1090.4|2017-01-13|OPEC deal with non-members a tailwind for E&P biz: RIL CFO
-49.15000000000009|2017-01-16|1041.25|2017-01-17|1090.4|2017-01-13|RIL may correct but not substantially, say experts
-49.15000000000009|2017-01-16|1041.25|2017-01-17|1090.4|2017-01-13|Hold Reliance Industries, says Gaurang Shah
-49.15000000000009|2017-01-16|1041.25|2017-01-17|1090.4|2017-01-13|Reliance Industries may move to Rs 1400-1450: Sandeep Wagle
-49.15000000000009|2017-01-16|1041.25|2017-01-17|1090.4|2017-01-13|Reliance Q3 profit rises 4% to Rs 8022 cr, GRM at $10.80/bbl
-49.15000000000009|2017-01-16|1041.25|2017-01-17|1090.4|2017-01-13|Reliance Q3 profit seen up at Rs 7850cr, GRM may be at $11.5/bbl
-43.700000000000045|2017-01-17|1032.55|2017-01-18|1076.25|2017-01-16|PTC India a big beneficiary of rising power demand: SP Tulsian
-43.700000000000045|2017-01-17|1032.55|2017-01-18|1076.25|2017-01-16|Refining biz to drive EBITDA; core projects key for RIL:analysts
-43.700000000000045|2017-01-17|1032.55|2017-01-18|1076.25|2017-01-16|Buy, sell, hold: 4 key largecap stocks to watch out today
-43.700000000000045|2017-01-17|1032.55|2017-01-18|1076.25|2017-01-16|Prakash Diwan prefers DHFL & Can Fin Homes over LIC Housing
-43.700000000000045|2017-01-17|1032.55|2017-01-18|1076.25|2017-01-16|Positive on RIL, earnings seen improving in Q1FY18: Religare
-43.700000000000045|2017-01-17|1032.55|2017-01-18|1076.25|2017-01-16|Buy Asian Paints; sell Reliance Industries: Mitessh Thakkar
-7.5499999999999545|2017-01-18|1033.7|2017-01-19|1041.25|2017-01-17|Reliance-SIBUR to set up butyl rubber unit at Jamnagar
-7.5499999999999545|2017-01-18|1033.7|2017-01-19|1041.25|2017-01-17|Buy Escorts, Chennai Petro, M&M Financial; sell ONGC: Gujral
-7.5499999999999545|2017-01-18|1033.7|2017-01-19|1041.25|2017-01-17|Buy NTPC, Tata Steel, Power Grid: Sudarshan Sukhani
-7.5499999999999545|2017-01-18|1033.7|2017-01-19|1041.25|2017-01-17|RIL, Russia's Sibur join hands for Jamnagar butyl rubber unit
-7.5499999999999545|2017-01-18|1033.7|2017-01-19|1041.25|2017-01-17|Buy UltraTech, Britannia, West Coast Paper Mills: Ashwani Gujral
-6.75|2017-01-19|1025.8|2017-01-20|1032.55|2017-01-18|Buy Reliance Industries; target of Rs 1413: Edelweiss
-6.75|2017-01-19|1025.8|2017-01-20|1032.55|2017-01-18|Accumulate Reliance Industries; target of Rs 1094: PL India
-6.75|2017-01-19|1025.8|2017-01-20|1032.55|2017-01-18|Buy Reliance Industries; target of Rs 1225: HDFC Securities
-6.75|2017-01-19|1025.8|2017-01-20|1032.55|2017-01-18|Buy Reliance Industries; target of Rs 1457: KR Choksey
-6.75|2017-01-19|1025.8|2017-01-20|1032.55|2017-01-18|RIL writes down nearly Rs 40K cr on change in accounting policy
-17.800000000000068|2017-01-20|1015.9|2017-01-23|1033.7|2017-01-19|Here is why SP Tulsian is bullish on PSU Banks
1.3999999999999773|2017-01-24|1017.3|2017-01-25|1015.9|2017-01-23|Buy Reliance Industries; target of Rs 1330: Axis Direct
1.3999999999999773|2017-01-24|1017.3|2017-01-25|1015.9|2017-01-23|Sell Yes Bank; buy Pidilite, Reliance Industries: Ashwani Gujral
19.700000000000045|2017-01-28|1044.8|2017-01-30|1025.1|2017-01-27|India Post gets payments bank licence to start services
